{
  "$schema": "https://json-schema.org/draft/2020-12/schema",
  "$id": "https://dotfiles.local/schemas/flow.transition-qualification-evidence.v1.schema.json",
  "title": "flow.transition-qualification-evidence/v1",
  "type": "object",
  "additionalProperties": false,
  "required": [
    "schema",
    "release_id",
    "qualification_base_commit",
    "candidate_tree_sha",
    "release_content_digest",
    "status",
    "scope",
    "contracts",
    "routes",
    "recipe",
    "assertions",
    "real_scenarios",
    "captured_at",
    "environment"
  ],
  "properties": {
    "schema": { "const": "flow.transition-qualification-evidence/v1" },
    "release_id": { "type": "string", "minLength": 1 },
    "qualification_base_commit": { "type": "string", "pattern": "^[0-9a-f]{40}$" },
    "candidate_tree_sha": { "type": "string", "pattern": "^[0-9a-f]{40}$" },
    "release_content_digest": { "$ref": "#/$defs/digest" },
    "status": { "const": "passed" },
    "scope": { "const": "deterministic_route_and_host_fault_conformance" },
    "contracts": {
      "type": "array",
      "minItems": 1,
      "items": { "type": "string", "minLength": 1 }
    },
    "routes": {
      "type": "object",
      "additionalProperties": false,
      "required": ["supported", "negative_classes"],
      "properties": {
        "supported": {
          "type": "array",
          "items": { "$ref": "#/$defs/route" }
        },
        "negative_classes": {
          "type": "array",
          "items": { "$ref": "#/$defs/negativeRoute" }
        }
      }
    },
    "recipe": {
      "type": "object",
      "additionalProperties": false,
      "required": ["schema", "digest", "commands"],
      "properties": {
        "schema": { "const": "flow.deterministic-qualification-recipe/v1" },
        "digest": { "$ref": "#/$defs/digest" },
        "commands": {
          "type": "array",
          "minItems": 1,
          "items": { "$ref": "#/$defs/command" }
        }
      }
    },
    "assertions": {
      "type": "array",
      "minItems": 1,
      "items": { "type": "string", "minLength": 1 }
    },
    "real_scenarios": {
      "type": "array",
      "items": {
        "type": "object",
        "additionalProperties": false,
        "required": ["id", "status"],
        "properties": {
          "id": { "type": "string", "minLength": 1 },
          "status": { "const": "not_run" }
        }
      }
    },
    "captured_at": {
      "type": "string",
      "pattern": "^\\d{4}-\\d{2}-\\d{2}T\\d{2}:\\d{2}:\\d{2}Z$"
    },
    "environment": {
      "type": "object",
      "additionalProperties": false,
      "required": ["os", "architecture", "node", "npm", "git"],
      "properties": {
        "os": { "type": "string", "minLength": 1 },
        "architecture": { "type": "string", "minLength": 1 },
        "node": { "type": "string", "minLength": 1 },
        "npm": { "type": "string", "minLength": 1 },
        "git": { "type": "string", "minLength": 1 }
      }
    }
  },
  "$defs": {
    "route": {
      "type": "object",
      "additionalProperties": false,
      "required": ["flow", "mode"],
      "properties": {
        "flow": { "type": "string", "minLength": 1 },
        "mode": { "type": "string", "minLength": 1 }
      }
    },
    "negativeRoute": {
      "type": "object",
      "additionalProperties": false,
      "required": ["flow", "mode", "outcome"],
      "properties": {
        "flow": { "type": "string", "minLength": 1 },
        "mode": { "type": "string", "minLength": 1 },
        "outcome": { "enum": ["disabled", "unsupported"] }
      }
    },
    "digest": {
      "type": "string",
      "pattern": "^sha256:[0-9a-f]{64}$"
    },
    "command": {
      "type": "object",
      "additionalProperties": false,
      "required": ["id", "command", "working_directory", "receipt_path", "receipt_sha256", "status", "exit_code", "tests", "passed", "failed", "cancelled", "skipped", "flaky"],
      "properties": {
        "id": { "type": "string", "minLength": 1 },
        "command": { "type": "string", "minLength": 1 },
        "working_directory": { "type": "string", "minLength": 1 },
        "receipt_path": { "type": "string", "minLength": 1 },
        "receipt_sha256": { "type": "string", "pattern": "^[0-9a-f]{64}$" },
        "status": { "const": "passed" },
        "exit_code": { "const": 0 },
        "tests": { "type": "integer", "minimum": 1 },
        "passed": { "type": "integer", "minimum": 0 },
        "failed": { "const": 0 },
        "cancelled": { "const": 0 },
        "skipped": { "const": 0 },
        "flaky": { "const": 0 }
      }
    }
  }
}
