{
  "schema": "flow.transition-qualification-evidence/v1",
  "release_id": "flow-release-1.0-dark/v1",
  "qualification_base_commit": "a4a9a88a330be2b668339cf1a9b1b7c1b992564e",
  "release_content_digest": "sha256:9a3ed69acec233892e00f8bcd4e6f7eb83cf25e913705b83bc6e99264b627baa",
  "status": "passed",
  "scope": "deterministic_route_and_host_fault_conformance",
  "contracts": [
    "flow.launch-policy/v1",
    "flow.launch-selection/v1",
    "flow.launch-rejection/v1",
    "flow.release-manifest/v1",
    "flow.transition-ledger/v1",
    "flow.transition-projection/v1",
    "flow.production-route-conformance-evidence/v1"
  ],
  "routes": {
    "supported": [
      {
        "flow": "feature",
        "mode": "verify"
      },
      {
        "flow": "review",
        "mode": "local"
      }
    ],
    "negative_classes": [
      {
        "flow": "feature",
        "mode": "test",
        "outcome": "disabled"
      },
      {
        "flow": "feature",
        "mode": "mixed",
        "outcome": "disabled"
      },
      {
        "flow": "spike",
        "mode": "quick",
        "outcome": "disabled"
      },
      {
        "flow": "spike",
        "mode": "deep",
        "outcome": "disabled"
      },
      {
        "flow": "epic",
        "mode": "default",
        "outcome": "disabled"
      },
      {
        "flow": "review",
        "mode": "github",
        "outcome": "unsupported"
      },
      {
        "flow": "tracker",
        "mode": "github",
        "outcome": "unsupported"
      },
      {
        "flow": "tracker",
        "mode": "jira",
        "outcome": "unsupported"
      },
      {
        "flow": "forge",
        "mode": "default",
        "outcome": "unsupported"
      },
      {
        "flow": "publication",
        "mode": "default",
        "outcome": "unsupported"
      },
      {
        "flow": "merge",
        "mode": "default",
        "outcome": "unsupported"
      },
      {
        "flow": "push",
        "mode": "default",
        "outcome": "unsupported"
      },
      {
        "flow": "remote",
        "mode": "mutation",
        "outcome": "unsupported"
      }
    ]
  },
  "recipe": {
    "schema": "flow.deterministic-qualification-recipe/v1",
    "digest": "sha256:42f7cc87e54dfff61eaa6f4e62a02c836588799adfa12adb7e1b645279e6a092",
    "commands": [
      {
        "id": "launch_selector",
        "command": "node --test tools/flow/test/launch-selector.test.mjs",
        "working_directory": ".",
        "receipt_path": "evidence/receipts/launch-selector.tap",
        "receipt_sha256": "59c652dea39045d536684438c78f930d126e42668025b53b79601e7775ad2911",
        "status": "passed",
        "exit_code": 0,
        "tests": 20,
        "passed": 20,
        "failed": 0,
        "cancelled": 0,
        "skipped": 0,
        "flaky": 0
      },
      {
        "id": "release_tree_integrity",
        "command": "node --test --test-name-pattern='release content binds|release content validates from a fresh clone|release-content generator excludes ignored files|Git tree derivation matches|release manifest with a missing governed file|candidate-tree bytes|wrong or unavailable candidate tree binding|evidence symlink outside authority|external symlink before reading' tools/flow/test/transition-projection.test.mjs",
        "working_directory": ".",
        "receipt_path": "evidence/receipts/release-tree-integrity.tap",
        "receipt_sha256": "add6a5b16871e583cb790a9559ddf4c4d8e1498659cfa8cb59b2d66debd1db7f",
        "status": "passed",
        "exit_code": 0,
        "tests": 9,
        "passed": 9,
        "failed": 0,
        "cancelled": 0,
        "skipped": 0,
        "flaky": 0
      },
      {
        "id": "contract_catalog",
        "command": "node --test tools/flow/test/contract-catalog.test.mjs",
        "working_directory": ".",
        "receipt_path": "evidence/receipts/contract-catalog.tap",
        "receipt_sha256": "ad958c8b94a7ddf378a85347e3a1e4c71190c352c493646e1eaeccdb1ab9f259",
        "status": "passed",
        "exit_code": 0,
        "tests": 20,
        "passed": 20,
        "failed": 0,
        "cancelled": 0,
        "skipped": 0,
        "flaky": 0
      },
      {
        "id": "feature_review_drovr_conformance",
        "command": "node --test tools/flow/test/feature-flow.test.mjs tools/flow/test/review-flow.test.mjs tools/flow/test/delegated-agent-port.test.mjs",
        "working_directory": ".",
        "receipt_path": "evidence/receipts/feature-review-drovr.tap",
        "receipt_sha256": "778ea9976f1c77c7c64b1a4384bb0c77181fcb872bef4be2f4092dcd202e5af3",
        "status": "passed",
        "exit_code": 0,
        "tests": 264,
        "passed": 264,
        "failed": 0,
        "cancelled": 0,
        "skipped": 0,
        "flaky": 0
      },
      {
        "id": "production_runtime_reboot",
        "command": "node --test --test-name-pattern='default FlowRuntime is durable|default production work evidence fails closed|production reboot observation|production critique evidence is strict' config/flow/test/production-runtime.test.mjs",
        "working_directory": ".",
        "receipt_path": "evidence/receipts/production-runtime-reboot.tap",
        "receipt_sha256": "8aaa481ee9db03bb347ba98e960fdc24d3c42c84f6bbf8d274b682f228045a08",
        "status": "passed",
        "exit_code": 0,
        "tests": 6,
        "passed": 6,
        "failed": 0,
        "cancelled": 0,
        "skipped": 0,
        "flaky": 0
      },
      {
        "id": "public_host_negative_routes",
        "command": "node --test --test-name-pattern='public prepare withholds|public launch withholds|public dynamic prepare|public dynamic plans cannot|exact-definition graph with a registered push|public launch with opt-in rejects|public prepare requires explicit|public launch cannot bypass|public dark feature verify fails closed|public verify plans requiring unavailable|public local review rejects forged extra|public module imports cannot mint|public admission withholds qualification captured' config/flow/test/runtime.test.mjs",
        "working_directory": ".",
        "receipt_path": "evidence/receipts/public-host-negative-routes.tap",
        "receipt_sha256": "facb4759614a05b2903bc40055c417fe893edff0e873b4a6855a6414820f09ff",
        "status": "passed",
        "exit_code": 0,
        "tests": 20,
        "passed": 20,
        "failed": 0,
        "cancelled": 0,
        "skipped": 0,
        "flaky": 0
      },
      {
        "id": "host_fault_reboot",
        "command": "node --test --test-skip-pattern='public host (?:rebuilds the review inbox after the producing client exits|supersedes a production review and rejects stale follow-up actions)' config/flow/test/host-lifecycle.test.mjs config/flow/test/public-process.test.mjs",
        "working_directory": ".",
        "receipt_path": "evidence/receipts/host-fault-reboot.tap",
        "receipt_sha256": "2946403d024412a7411195131710fdbdf4134b3d5abd9ab6f8b3722f841aee05",
        "status": "passed",
        "exit_code": 0,
        "tests": 36,
        "passed": 36,
        "failed": 0,
        "cancelled": 0,
        "skipped": 0,
        "flaky": 0
      },
      {
        "id": "schema_contracts",
        "command": "node --test config/flow/test/schema-contracts.test.mjs",
        "working_directory": ".",
        "receipt_path": "evidence/receipts/schema-contracts.tap",
        "receipt_sha256": "fe1737cbe88f7e5adf2098317e9d2a2cdef7a4a890a8fd340fd0627fdae85239",
        "status": "passed",
        "exit_code": 0,
        "tests": 12,
        "passed": 12,
        "failed": 0,
        "cancelled": 0,
        "skipped": 0,
        "flaky": 0
      }
    ]
  },
  "assertions": [
    "legacy Claude remains the repeated default policy selection",
    "dark opt-in resolves only exact feature verify and local review routes",
    "dynamic, unknown, and mixed dangerous executor routes are rejected",
    "failed, blocked, not-run, and tampered qualification withholds admission",
    "feature verify and local review pass core conformance with the Drovr port",
    "unavailable feature operations fail before a public route is admitted",
    "public host fault, restart, and reboot suites pass without remote authority",
    "phase-one host-fault suites use the registered-operation test runtime; production positives are qualified separately",
    "release content binds the exact governed tree and contained regular files",
    "normal use and remote mutation authority remain false",
    "prerequisite integrity remains bound to the declared qualification base"
  ],
  "real_scenarios": [
    {
      "id": "issue-84",
      "status": "not_run"
    },
    {
      "id": "issue-44",
      "status": "not_run"
    },
    {
      "id": "issue-46",
      "status": "not_run"
    },
    {
      "id": "quick-spike",
      "status": "not_run"
    }
  ],
  "captured_at": "2026-09-20T20:33:56Z",
  "environment": {
    "os": "linux",
    "architecture": "x64",
    "node": "v22.23.1",
    "npm": "10.9.8",
    "git": "2.53.0"
  },
  "candidate_tree_sha": "3ca6bc7e76da04004bf689881d0ef49e1c84aa9b"
}
